{
  "industry": "eVTOL",
  "industry_name": "Electric Vertical Takeoff and Landing - NEW SOURCES TEST",
  "description": "Testing only the 4 new financial data sources",

  "date_range": {
    "days_back": 180
  },

  "output_config": {
    "base_dir": "./data",
    "industry_folder": "eVTOL_new_sources_test",
    "create_timestamp_subfolder": false,
    "folder_structure": {
      "sec": "sec_filings",
      "stock_market": "stock_market",
      "gov_contracts": "government_contracts",
      "institutional_holdings": "institutional_holdings"
    }
  },

  "keywords": {
    "core": [
      "eVTOL",
      "electric VTOL",
      "urban air mobility",
      "flying taxi",
      "air taxi",
      "advanced air mobility"
    ]
  },

  "companies": {
    "public": {
      "JOBY": "Joby Aviation",
      "ACHR": "Archer Aviation",
      "LILM": "Lilium N.V.",
      "EVEX": "Eve Air Mobility",
      "EVTL": "Vertical Aerospace",
      "BLDE": "Blade Air Mobility"
    }
  },

  "data_sources": {
    "company_fundamentals": {
      "enabled": false,
      "comment": "DISABLED FOR THIS TEST"
    },
    "patents": {
      "enabled": false,
      "comment": "DISABLED FOR THIS TEST"
    },
    "github": {
      "enabled": false,
      "comment": "DISABLED FOR THIS TEST"
    },
    "sec_filings": {
      "enabled": true,
      "types": ["4"],
      "priority": 1,
      "comment": "TEST: Only Form 4 (insider transactions) - NEW!"
    },
    "earnings": {
      "enabled": false,
      "comment": "DISABLED FOR THIS TEST"
    },
    "research": {
      "enabled": false,
      "comment": "DISABLED FOR THIS TEST"
    },
    "regulatory": {
      "enabled": false,
      "comment": "DISABLED FOR THIS TEST"
    },
    "press": {
      "enabled": false,
      "comment": "DISABLED FOR THIS TEST"
    },
    "news_sentiment": {
      "enabled": false,
      "comment": "DISABLED FOR THIS TEST"
    },
    "citations": {
      "enabled": false,
      "comment": "DISABLED FOR THIS TEST"
    },
    "jobs": {
      "enabled": false,
      "comment": "DISABLED FOR THIS TEST"
    },
    "stock_market": {
      "enabled": true,
      "history_period": "3mo",
      "download_options": true,
      "priority": 1,
      "comment": "NEW SOURCE - Yahoo Finance (stock prices, options, short interest, analysts)"
    },
    "government_contracts": {
      "enabled": true,
      "agencies": ["DOD", "NASA", "FAA", "DOT"],
      "years_back": 5,
      "min_contract_value": 50000,
      "priority": 2,
      "comment": "NEW SOURCE - USASpending.gov (federal contracts)"
    },
    "institutional_holdings": {
      "enabled": true,
      "quarters_back": 4,
      "priority": 3,
      "comment": "NEW SOURCE - 13F filings (stub/framework test)"
    }
  },

  "free_tier_limits": {
    "respect_rate_limits": true
  }
}
