{
  "industry": "eVTOL",
  "industry_name": "eVTOL - Insider Transactions Orchestrator Test",
  "description": "Test insider transactions with 3 companies via orchestrator",

  "date_range": {
    "days_back": 365
  },

  "keywords": {
    "core": ["eVTOL"]
  },

  "output_config": {
    "base_dir": "./data",
    "industry_folder": "eVTOL_INSIDER_ORCHESTRATOR_TEST",
    "create_timestamp_subfolder": false,
    "folder_structure": {
      "insider_transactions": "insider_transactions"
    }
  },

  "companies": {
    "public": {
      "ACHR": "Archer Aviation Inc",
      "JOBY": "Joby Aero, Inc.",
      "BLDE": "Blade Air Mobility"
    }
  },

  "data_sources": {
    "company_fundamentals": {
      "enabled": false
    },
    "patents": {
      "enabled": false
    },
    "lens_patents": {
      "enabled": false
    },
    "github": {
      "enabled": false
    },
    "sec_filings": {
      "enabled": false
    },
    "earnings": {
      "enabled": false
    },
    "research": {
      "enabled": false
    },
    "regulatory": {
      "enabled": false
    },
    "press": {
      "enabled": false
    },
    "news_sentiment": {
      "enabled": false
    },
    "citations": {
      "enabled": false
    },
    "jobs": {
      "enabled": false
    },
    "stock_market": {
      "enabled": false
    },
    "government_contracts": {
      "enabled": false
    },
    "institutional_holdings": {
      "enabled": false
    },
    "form13f_holdings": {
      "enabled": false
    },
    "lens_scholarly": {
      "enabled": false
    },
    "insider_transactions": {
      "enabled": true,
      "priority": 1,
      "comment": "TEST - 3 companies only via orchestrator"
    }
  },

  "free_tier_limits": {
    "respect_rate_limits": true
  }
}
