{
  "industry": "eVTOL",
  "industry_name": "Electric Vertical Takeoff and Landing",
  "description": "Company fundamentals only - FMP API free tier",

  "date_range": {
    "days_back": 180
  },

  "output_config": {
    "base_dir": "./data",
    "industry_folder": "eVTOL",
    "create_timestamp_subfolder": false,
    "folder_structure": {
      "company_fundamentals": "company_fundamentals",
      "patents": "patents",
      "github": "github_activity",
      "sec": "sec_filings",
      "earnings": "earnings_calls",
      "research": "research_papers",
      "regulatory": "regulatory_docs",
      "press": "press_releases",
      "news": "news_sentiment",
      "citations": "academic_citations",
      "jobs": "job_postings"
    }
  },

  "keywords": {
    "core": [
      "eVTOL",
      "electric VTOL",
      "urban air mobility",
      "flying taxi",
      "air taxi",
      "advanced air mobility"
    ],
    "technology": [
      "distributed electric propulsion",
      "tilt-rotor electric",
      "multirotor aircraft",
      "lift-cruise configuration",
      "DEP aircraft",
      "electric aircraft",
      "VTOL aircraft"
    ],
    "infrastructure": [
      "vertiport",
      "UAM infrastructure",
      "vertical landing pad",
      "skyport",
      "AAM infrastructure"
    ],
    "safety": [
      "detect and avoid eVTOL",
      "autonomous flight control VTOL",
      "eVTOL certification",
      "FAA Part 135",
      "EASA SC-VTOL"
    ]
  },

  "companies": {
    "public": {
      "JOBY": "Joby Aviation",
      "ACHR": "Archer Aviation",
      "LILM": "Lilium N.V.",
      "EVEX": "Eve Air Mobility",
      "EVTL": "Vertical Aerospace",
      "BLDE": "Blade Air Mobility",
      "BA": "Boeing Company",
      "LMT": "Lockheed Martin",
      "TXT": "Textron Inc.",
      "HO": "Honeywell International"
    },
    "private": {
      "VOLOCOPTER": "Volocopter GmbH",
      "WISK": "Wisk Aero",
      "BETA": "Beta Technologies",
      "EHANG": "EHang Holdings",
      "OVERAIR": "Overair",
      "KITTY_HAWK": "Kitty Hawk Corporation"
    }
  },

  "data_sources": {
    "company_fundamentals": {
      "enabled": true,
      "priority": 1,
      "comment": "FMP API free tier - company profiles, financials, metrics, news (250 calls/day)"
    },
    "patents": {
      "enabled": false
    },
    "github": {
      "enabled": false
    },
    "sec_filings": {
      "enabled": false
    },
    "earnings": {
      "enabled": false
    },
    "research": {
      "enabled": false
    },
    "regulatory": {
      "enabled": false
    },
    "press": {
      "enabled": false
    },
    "news_sentiment": {
      "enabled": false
    },
    "citations": {
      "enabled": false
    },
    "jobs": {
      "enabled": false
    }
  },

  "free_tier_limits": {
    "patents_per_hour": 1000,
    "github_per_hour": 4500,
    "news_per_day": 10000,
    "citations_per_day": 50000,
    "respect_rate_limits": true
  }
}
